{
  "ruleset": {
    "id": "awbw",
    "revision": "2026-07-10"
  },
  "settings": {
    "fog": false,
    "income_per_property": 1000,
    "starting_funds": 0,
    "powers": "enabled",
    "tags": false,
    "weather": "clear",
    "lab_units": [],
    "unit_bans": [
      "stealth",
      "black-bomb"
    ],
    "commander_bans": {
      "lead": [],
      "backup": []
    },
    "capture_limit": null,
    "day_limit": 8,
    "unit_limit": null
  },
  "board": {
    "width": 20,
    "height": 20,
    "tiles": [
      [
        {
          "terrain": "reef"
        },
        {
          "terrain": "sea"
        },
        {
          "terrain": "sea"
        },
        {
          "terrain": "sea"
        },
        {
          "terrain": "sea"
        },
        {
          "terrain": "sea"
        },
        {
          "terrain": "sea"
        },
        {
          "terrain": "reef"
        },
        {
          "terrain": "sea"
        },
        {
          "terrain": "shoal"
        },
        {
          "terrain": "mountain"
        },
        {
          "terrain": "road"
        },
        {
          "terrain": "mountain"
        },
        {
          "terrain": "mountain"
        },
        {
          "terrain": "missile-silo",
          "silo": "spent"
        },
        {
          "terrain": "plain"
        },
        {
          "terrain": "road"
        },
        {
          "terrain": "pipe"
        },
        {
          "terrain": "plain"
        },
        {
          "terrain": "sea"
        }
      ],
      [
        {
          "terrain": "sea"
        },
        {
          "terrain": "shoal"
        },
        {
          "terrain": "road"
        },
        {
          "terrain": "wood"
        },
        {
          "terrain": "mountain"
        },
        {
          "terrain": "shoal"
        },
        {
          "terrain": "sea"
        },
        {
          "terrain": "shoal"
        },
        {
          "terrain": "shoal"
        },
        {
          "terrain": "plain"
        },
        {
          "terrain": "plain"
        },
        {
          "terrain": "airport",
          "owner": null,
          "capture_points": 20
        },
        {
          "terrain": "plain"
        },
        {
          "terrain": "plain"
        },
        {
          "terrain": "plain"
        },
        {
          "terrain": "city",
          "owner": null,
          "capture_points": 20
        },
        {
          "terrain": "road"
        },
        {
          "terrain": "pipe"
        },
        {
          "terrain": "missile-silo",
          "silo": "spent"
        },
        {
          "terrain": "reef"
        }
      ],
      [
        {
          "terrain": "shoal"
        },
        {
          "terrain": "city",
          "owner": null,
          "capture_points": 20
        },
        {
          "terrain": "road"
        },
        {
          "terrain": "missile-silo",
          "silo": "spent"
        },
        {
          "terrain": "wood"
        },
        {
          "terrain": "city",
          "owner": null,
          "capture_points": 20
        },
        {
          "terrain": "road"
        },
        {
          "terrain": "plain"
        },
        {
          "terrain": "road"
        },
        {
          "terrain": "wood"
        },
        {
          "terrain": "plain"
        },
        {
          "terrain": "plain"
        },
        {
          "terrain": "city",
          "owner": null,
          "capture_points": 20
        },
        {
          "terrain": "plain"
        },
        {
          "terrain": "wood"
        },
        {
          "terrain": "plain"
        },
        {
          "terrain": "road"
        },
        {
          "terrain": "wood"
        },
        {
          "terrain": "shoal"
        },
        {
          "terrain": "sea"
        }
      ],
      [
        {
          "terrain": "road"
        },
        {
          "terrain": "road"
        },
        {
          "terrain": "plain"
        },
        {
          "terrain": "plain"
        },
        {
          "terrain": "plain"
        },
        {
          "terrain": "road"
        },
        {
          "terrain": "road"
        },
        {
          "terrain": "base",
          "owner": null,
          "capture_points": 20
        },
        {
          "terrain": "road"
        },
        {
          "terrain": "plain"
        },
        {
          "terrain": "road"
        },
        {
          "terrain": "wood"
        },
        {
          "terrain": "plain"
        },
        {
          "terrain": "plain"
        },
        {
          "terrain": "plain"
        },
        {
          "terrain": "road"
        },
        {
          "terrain": "road"
        },
        {
          "terrain": "base",
          "owner": "1",
          "capture_points": 20
        },
        {
          "terrain": "shoal"
        },
        {
          "terrain": "sea"
        }
      ],
      [
        {
          "terrain": "road"
        },
        {
          "terrain": "plain"
        },
        {
          "terrain": "base",
          "owner": "1",
          "capture_points": 20
        },
        {
          "terrain": "plain"
        },
        {
          "terrain": "road"
        },
        {
          "terrain": "mountain"
        },
        {
          "terrain": "road"
        },
        {
          "terrain": "road"
        },
        {
          "terrain": "plain"
        },
        {
          "terrain": "missile-silo",
          "silo": "spent"
        },
        {
          "terrain": "road"
        },
        {
          "terrain": "road"
        },
        {
          "terrain": "plain"
        },
        {
          "terrain": "wood"
        },
        {
          "terrain": "road"
        },
        {
          "terrain": "road"
        },
        {
          "terrain": "city",
          "owner": null,
          "capture_points": 20
        },
        {
          "terrain": "plain"
        },
        {
          "terrain": "plain"
        },
        {
          "terrain": "shoal"
        }
      ],
      [
        {
          "terrain": "mountain"
        },
        {
          "terrain": "plain"
        },
        {
          "terrain": "road"
        },
        {
          "terrain": "wood"
        },
        {
          "terrain": "road"
        },
        {
          "terrain": "shoal"
        },
        {
          "terrain": "shoal"
        },
        {
          "terrain": "road"
        },
        {
          "terrain": "city",
          "owner": null,
          "capture_points": 20
        },
        {
          "terrain": "plain"
        },
        {
          "terrain": "plain"
        },
        {
          "terrain": "road"
        },
        {
          "terrain": "city",
          "owner": null,
          "capture_points": 20
        },
        {
          "terrain": "plain"
        },
        {
          "terrain": "road"
        },
        {
          "terrain": "plain"
        },
        {
          "terrain": "plain"
        },
        {
          "terrain": "plain"
        },
        {
          "terrain": "city",
          "owner": null,
          "capture_points": 20
        },
        {
          "terrain": "plain"
        }
      ],
      [
        {
          "terrain": "mountain"
        },
        {
          "terrain": "wood"
        },
        {
          "terrain": "road"
        },
        {
          "terrain": "city",
          "owner": null,
          "capture_points": 20
        },
        {
          "terrain": "road"
        },
        {
          "terrain": "shoal"
        },
        {
          "terrain": "shoal"
        },
        {
          "terrain": "road"
        },
        {
          "terrain": "plain"
        },
        {
          "terrain": "wood"
        },
        {
          "terrain": "mountain"
        },
        {
          "terrain": "plain"
        },
        {
          "terrain": "plain"
        },
        {
          "terrain": "plain"
        },
        {
          "terrain": "hq",
          "owner": "1",
          "capture_points": 20
        },
        {
          "terrain": "mountain"
        },
        {
          "terrain": "mountain"
        },
        {
          "terrain": "missile-silo",
          "silo": "spent"
        },
        {
          "terrain": "road"
        },
        {
          "terrain": "road"
        }
      ],
      [
        {
          "terrain": "wood"
        },
        {
          "terrain": "plain"
        },
        {
          "terrain": "road"
        },
        {
          "terrain": "plain"
        },
        {
          "terrain": "missile-silo",
          "silo": "spent"
        },
        {
          "terrain": "missile-silo",
          "silo": "spent"
        },
        {
          "terrain": "missile-silo",
          "silo": "spent"
        },
        {
          "terrain": "missile-silo",
          "silo": "spent"
        },
        {
          "terrain": "plain"
        },
        {
          "terrain": "wood"
        },
        {
          "terrain": "mountain"
        },
        {
          "terrain": "plain"
        },
        {
          "terrain": "road"
        },
        {
          "terrain": "plain"
        },
        {
          "terrain": "road"
        },
        {
          "terrain": "road"
        },
        {
          "terrain": "plain"
        },
        {
          "terrain": "plain"
        },
        {
          "terrain": "wood"
        },
        {
          "terrain": "mountain"
        }
      ],
      [
        {
          "terrain": "plain"
        },
        {
          "terrain": "road"
        },
        {
          "terrain": "road"
        },
        {
          "terrain": "plain"
        },
        {
          "terrain": "plain"
        },
        {
          "terrain": "mountain"
        },